[
  {
    "id": "scenario-avd-cost-control",
    "bucket": "Cost Optimization",
    "title": "MSP evaluating AVD cost control",
    "description": "A multi-tenant MSP wants sharper Azure Virtual Desktop cost visibility before expanding hosted desktops for two new clients.",
    "tags": ["avd", "cost optimization", "msp", "multi-tenant"],
    "record": {
      "id": "lead-avd-cost-control",
      "subject": "Need a cleaner AVD cost control story for new managed desktop clients",
      "company": "Northline MSP Group",
      "segment": "MSP",
      "employeeRange": "201-500",
      "microsoftFootprint": ["Azure", "Azure Virtual Desktop", "Microsoft 365"],
      "useCase": "AVD cost optimization for multi-tenant managed desktop environments",
      "buyerPersona": "Director of Cloud Services",
      "leadSource": "Partner webinar",
      "owner": "Avery Chen",
      "stage": "Active",
      "stageEnteredAt": "2026-03-27T14:15:00Z",
      "createdAt": "2026-03-25T13:00:00Z",
      "lastTouchAt": "2026-03-28T15:45:00Z",
      "nextTouchDueAt": "2026-03-29T16:00:00Z",
      "painPoints": [
        "Azure spend spikes after hours",
        "Manual host-pool right-sizing across tenants",
        "Need a sharper finance-ready cost narrative"
      ],
      "objections": [
        "Already built some internal Power BI reporting",
        "Wants proof the operational layer will save engineer time"
      ],
      "buyingSignals": [
        "Asked for a side-by-side MSP workflow walkthrough",
        "Shared active margin targets for desktop services"
      ],
      "activities": [
        {
          "id": "activity-avd-1",
          "type": "outbound-email",
          "owner": "Avery Chen",
          "timestamp": "2026-03-26T14:00:00Z",
          "channel": "email",
          "outcome": "Delivered",
          "summary": "Sent first-touch note tying AVD host-pool savings to managed service margins.",
          "nextStep": "Share a follow-up with cost-control proof points.",
          "crmUpdated": true
        },
        {
          "id": "activity-avd-2",
          "type": "reply-received",
          "owner": "Avery Chen",
          "timestamp": "2026-03-27T13:30:00Z",
          "channel": "email",
          "outcome": "Positive reply",
          "summary": "Prospect asked how the team would compare AVD scaling versus current scripts.",
          "nextStep": "Send MSP cost-control angle and propose a working session.",
          "crmUpdated": true
        },
        {
          "id": "activity-avd-3",
          "type": "linkedin-touch",
          "owner": "Avery Chen",
          "timestamp": "2026-03-28T15:45:00Z",
          "channel": "linkedin",
          "outcome": "Accepted",
          "summary": "Connected with the cloud services director after the reply thread slowed down.",
          "nextStep": "Follow up with a concise cost-optimization summary today.",
          "crmUpdated": false
        }
      ],
      "playbookMatches": ["playbook-avd-cost-control", "playbook-msp-multi-tenant"],
      "review": {
        "deduplication": "Single active account owner confirmed; no duplicate account records found.",
        "stageCriteria": "Discovery criteria met because pain points, workload scope, and buyer role are documented.",
        "nextStepPlan": "Deliver cost narrative and propose 30-minute technical discovery.",
        "handoffNotes": "Hold handoff until a multi-tenant reporting requirement is validated.",
        "playbookStatus": "updated"
      },
      "scorecard": {
        "total": 82,
        "metrics": [
          { "id": "crmCompleteness", "label": "CRM completeness", "value": 13, "max": 15, "note": "Core account and workload fields are populated." },
          { "id": "dataHygiene", "label": "Data hygiene", "value": 13, "max": 15, "note": "Owner and dated next step are present; no duplicate warning." },
          { "id": "icpFitJudgment", "label": "ICP fit judgment", "value": 14, "max": 15, "note": "Strong MSP + Azure desktop motion with direct cost pressure." },
          { "id": "followUpTimeliness", "label": "Follow-up timeliness", "value": 11, "max": 15, "note": "Next step is due today, so execution pressure is rising." },
          { "id": "personalizationQuality", "label": "Personalization quality", "value": 8, "max": 10, "note": "Touches reference the MSP margin angle instead of generic VDI messaging." },
          { "id": "nextStepClarity", "label": "Next-step clarity", "value": 8, "max": 10, "note": "Follow-up is dated and tied to a concrete proof point." },
          { "id": "handoffReadiness", "label": "Handoff readiness", "value": 7, "max": 10, "note": "Needs one more technical validation before AE handoff." },
          { "id": "reportingCompleteness", "label": "Reporting completeness", "value": 8, "max": 10, "note": "Activity history and source are ready for weekly review." }
        ]
      },
      "aiSummary": "Northline MSP Group is evaluating a stronger AVD cost-control story for multi-tenant managed desktops and is responsive to margin-focused proof points.",
      "recommendedNextAction": "Send a tight email connecting right-sizing and after-hours shutdown controls to margin protection, then ask for a discovery slot.",
      "crmCompleteness": 88,
      "disqualificationReason": ""
    },
    "accountProfile": {
      "accountId": "acct-201",
      "name": "Northline MSP Group",
      "timezone": "America/Chicago",
      "region": "Central US",
      "existingStack": "Azure, AVD, Microsoft 365, custom Power BI scripts",
      "microsoftPriority": "Azure Virtual Desktop",
      "motion": "Partner-led MSP expansion"
    },
    "handoffPlan": {
      "currentPath": "SDR discovery",
      "path": ["SDR discovery", "Technical validation", "AE handoff"],
      "notes": "Do not hand off until the MSP reporting and host-pool governance questions are documented."
    }
  },
  {
    "id": "scenario-windows365-byod",
    "bucket": "BYOD rollout",
    "title": "Contractor fleet for Windows 365",
    "description": "A services company wants contractor desktops without shipping hardware and needs a BYOD-safe Cloud PC motion.",
    "tags": ["windows 365", "cloud pc", "contractors", "byod"],
    "record": {
      "id": "lead-windows365-byod",
      "subject": "Looking at Cloud PCs for a contractor-heavy BYOD team",
      "company": "BlueRidge Advisory",
      "segment": "Mid-market services",
      "employeeRange": "501-1000",
      "microsoftFootprint": ["Microsoft 365", "Entra ID"],
      "useCase": "Windows 365 rollout for seasonal contractors on personal devices",
      "buyerPersona": "IT Operations Manager",
      "leadSource": "Inbound demo request",
      "owner": "Jordan Ellis",
      "stage": "New lead",
      "stageEnteredAt": "2026-03-29T09:10:00Z",
      "createdAt": "2026-03-29T09:10:00Z",
      "lastTouchAt": "2026-03-29T09:10:00Z",
      "nextTouchDueAt": "2026-03-29T18:00:00Z",
      "painPoints": [
        "Contractors onboard too quickly for laptop shipping",
        "Security team is uneasy about unmanaged personal devices"
      ],
      "objections": [
        "Worried Cloud PCs may be overkill for short-term workers"
      ],
      "buyingSignals": [
        "Submitted a demo form naming BYOD and contractor access"
      ],
      "activities": [
        {
          "id": "activity-w365-1",
          "type": "enrichment-update",
          "owner": "Jordan Ellis",
          "timestamp": "2026-03-29T09:20:00Z",
          "channel": "crm",
          "outcome": "Enriched",
          "summary": "Captured company size, buyer role, and Microsoft 365 footprint from the inbound form.",
          "nextStep": "Send first-touch email before end of day.",
          "crmUpdated": true
        }
      ],
      "playbookMatches": ["playbook-windows365-byod"],
      "review": {
        "deduplication": "Net-new account from inbound queue; no duplicate domain found.",
        "stageCriteria": "Still in intake because there has been no outbound touch yet.",
        "nextStepPlan": "Send first-touch email focused on secure contractor onboarding.",
        "handoffNotes": "No handoff until timing, seat count, and security constraints are confirmed.",
        "playbookStatus": "not-needed"
      },
      "scorecard": {
        "total": 66,
        "metrics": [
          { "id": "crmCompleteness", "label": "CRM completeness", "value": 11, "max": 15, "note": "Basic form data is present but persona detail is still light." },
          { "id": "dataHygiene", "label": "Data hygiene", "value": 12, "max": 15, "note": "Owner and dated next step exist, so the record is workable." },
          { "id": "icpFitJudgment", "label": "ICP fit judgment", "value": 12, "max": 15, "note": "BYOD plus contractor access is a strong Windows 365 fit." },
          { "id": "followUpTimeliness", "label": "Follow-up timeliness", "value": 10, "max": 15, "note": "First touch is due today." },
          { "id": "personalizationQuality", "label": "Personalization quality", "value": 6, "max": 10, "note": "No outbound personalization yet." },
          { "id": "nextStepClarity", "label": "Next-step clarity", "value": 7, "max": 10, "note": "The next action is clear but not yet executed." },
          { "id": "handoffReadiness", "label": "Handoff readiness", "value": 2, "max": 10, "note": "Too early for handoff." },
          { "id": "reportingCompleteness", "label": "Reporting completeness", "value": 6, "max": 10, "note": "Source and enrichment are captured, but outreach history is thin." }
        ]
      },
      "aiSummary": "BlueRidge Advisory is a new inbound lead interested in secure contractor access without device shipping, which points directly to a Windows 365 BYOD story.",
      "recommendedNextAction": "Send a first-touch email that frames Cloud PCs as a fast path for secure contractor onboarding on unmanaged devices.",
      "crmCompleteness": 74,
      "disqualificationReason": ""
    },
    "accountProfile": {